{"schemaVersion":"AUTO_STOCK_V1","stockId":"chemdog-1-s1","status":"IMAGE_PENDING","createdAt":"2026-08-19T09:46:00Z","candidate":{"id":"chemdog-1-s1","canonicalName":"Chemdog #1 S1","strainData":{"schemaVersion":1,"id":"chemdog-1-s1","status":"review","name":"Chemdog #1 S1","jp":null,"aliases":[],"classification":{"type":"unknown"},"breeding":{"generation":"S1","method":"selfed"},"lineage":{"status":"confirmed","confidence":"A","basis":"breederOfficial","sourceRefs":["humboldt-csi-chemdog-1-s1"],"display":"Chemdog #1 × Chemdog #1","parents":["Chemdog #1"],"note":"Humboldt CSI's official Chemdog #1 S1 page lists the cultivar as Chemdog #1 × Chemdog #1. Together with the official S1 designation, this is treated as a selfed S1 line. No unstated ancestry is copied from the parent cultivar."},"relations":[{"entityId":"humboldt-csi","roles":["breeder","seedCompany"],"status":"confirmed","confidence":"A","basis":"breederOfficial","sourceRefs":["humboldt-csi-chemdog-1-s1"]}],"aromas":{"status":"unknown","items":[],"note":"The official Chemdog #1 S1 product page is not used to generalize parent-cut aroma claims to the complete S1 line."},"terpenes":{"status":"unknown","items":[],"note":"The official Chemdog #1 S1 product page does not provide a cultivar-specific lot terpene profile or COA for the S1 line."},"origin":{"status":"unknown","text":"","note":"The official Chemdog #1 S1 page does not state the S1 line's exact creation location; no inferred location is added."},"history":{"status":"unknown","text":"","note":"The official Chemdog #1 S1 page does not provide a sufficiently bounded cultivar-specific release chronology for this atlas entry; no secondary history is imported."},"visuals":[],"checkedAt":"2026-08-19","updatedAt":"2026-08-19"}},"confidence":{"lineage":{"grade":"A","basis":"Humboldt CSI directly identifies Chemdog #1 S1 as an S1 and lists the same cultivar on both sides of the cross.","sourceIds":["humboldt-csi-chemdog-1-s1"]},"history":{"grade":"unknown","basis":"No bounded cultivar-specific release/development chronology is imported from the official page."},"aroma":{"grade":"unknown","basis":"Parent-cut or page-level aroma statements are not generalized to the complete S1 line."},"terpene":{"grade":"unknown","basis":"No cultivar-specific lot terpene profile or COA is available for the S1 line."}},"sources":[{"id":"humboldt-csi-chemdog-1-s1","url":"https://www.humboldtcsi.com/product/chemdog-1-s1/","payload":{"schemaVersion":1,"id":"humboldt-csi-chemdog-1-s1","publisher":"Humboldt CSI","title":"Chemdog #1 S1","url":"https://www.humboldtcsi.com/product/chemdog-1-s1/","sourceType":"breederOfficial","supports":["lineage","breeder","generation","breeding"],"publishedAt":null,"checkedAt":"2026-08-19","note":"Official Humboldt CSI product page identifies Chemdog #1 S1 as Chemdog #1 × Chemdog #1 and lists feminized seeds. Parent-cut notes are not generalized into cultivar-wide visual morphology for the S1 line."}}],"entities":[{"id":"humboldt-csi","canonicalName":"Humboldt CSI","payload":{"schemaVersion":1,"id":"humboldt-csi","name":"Humboldt CSI","roles":["breeder","seedCompany"],"status":"confirmed","checkedAt":"2026-08-16","updatedAt":"2026-08-16"}}],"duplicateCheck":{"productionChecked":true,"stockChecked":true,"strain":{"key":"id=chemdog-1-s1; canonicalName=Chemdog #1 S1","result":"UNIQUE","reason":"No matching production strain ID/canonical name, publication entry, or existing STOCK item at the checked master-migration HEAD."},"sources":[{"key":"id=humboldt-csi-chemdog-1-s1; url=https://www.humboldtcsi.com/product/chemdog-1-s1/","result":"UNIQUE","reason":"No existing production or STOCK source uses this source ID or exact official URL."}],"entities":[{"key":"id=humboldt-csi; canonicalName=Humboldt CSI","result":"MATCH","matchedPath":"entities/humboldt-csi.json","reason":"Existing production entity ID and canonical name match; the production entity payload is reused exactly and no entity file is proposed."}]},"visualStatus":"IMAGE_PENDING","visualPreparation":{"prompt":"Photorealistic botanical reference image of one mature flowering cannabis plant representing Chemdog #1 S1, complete plant visible, neutral natural light, realistic botany. Do not assert cultivar-specific architecture, branching pattern, internode spacing, leaf width, flower shape, flower density, coloration, or resin/trichome intensity beyond ordinary natural cannabis morphology unless directly supported by the cited official cultivar page. No labels, logos, packaging, people, smoke, consumption context, text, or invented signature coloration.","evidence":[{"description":"Humboldt CSI's official Chemdog #1 S1 page confirms cultivar identity and S1/selfed parentage. The generation prompt intentionally avoids unsupported cultivar-wide morphology claims.","sourceIds":["humboldt-csi-chemdog-1-s1"]}],"alt":"Chemdog #1 S1の公式S1同定情報を基礎に、未確認の品種固有形態を付加せず作成するAI生成の植物学的参考ビジュアル","rights":"AI-generated project asset for Cannabis Strain Wisdom. No third-party image is copied; the prompt is constrained to claims supported by the cited official cultivar page.","scope":"cultivar","aiGenerated":true},"visuals":[],"notes":"AUTO STOCK V1 candidate prepared for the next S1-priority production batch. Official breeder source confirms S1/selfed identity; unsupported parent traits are not copied. No image generated in stock preparation."}
