{"schemaVersion":"AUTO_STOCK_V1","stockId":"warlock","status":"IMAGE_PENDING","createdAt":"2026-08-17T18:54:00Z","candidate":{"id":"warlock","canonicalName":"Warlock","strainData":{"schemaVersion":1,"id":"warlock","status":"review","name":"Warlock","jp":null,"aliases":[],"classification":{"type":"indica"},"breeding":{"generation":"F1","method":"mostly indica hybrid"},"lineage":{"status":"confirmed","confidence":"A","basis":"breederOfficial","display":"Skunk × Afghani","parents":["Skunk","Afghani"],"note":"Serious Seeds directly identifies Warlock as a cross between Skunk and a strain from Afghanistan.","sourceRefs":["serious-seeds-warlock"]},"relations":[{"entityId":"serious-seeds","roles":["breeder","seedCompany"],"status":"confirmed","confidence":"A","basis":"breederOfficial","sourceRefs":["serious-seeds-warlock"]}],"aromas":{"status":"confirmed","confidence":"A","basis":"breederOfficial","sourceRefs":["serious-seeds-warlock"],"items":["strong","sweet","acidic","fresh fruit"],"note":"Official cultivar-specific aroma descriptors; wording normalized without adding unsupported notes."},"terpenes":{"status":"unknown","confidence":"unknown","basis":"breederOfficial","sourceRefs":["serious-seeds-warlock"],"items":[],"note":"No named cultivar-specific terpene compound panel was verified; no compounds are inferred from aroma words."},"origin":{"status":"confirmed","confidence":"A","basis":"breederOfficial","sourceRefs":["serious-seeds-warlock"],"text":"Warlock originated as the flagship cultivar of Magus Genetics and is now maintained by Serious Seeds.","note":"Limited to breeder-published origin context; undisclosed details remain undisclosed."},"history":{"status":"confirmed","confidence":"A","basis":"breederOfficial","sourceRefs":["serious-seeds-warlock"],"text":"Serious Seeds states Warlock debuted in 1997 and won two High Times Cannabis Cup awards at its debut.","note":"Only dated or descriptive history stated on the current official page is retained."},"visuals":[],"checkedAt":"2026-08-17","updatedAt":"2026-08-17"}},"confidence":{"lineage":{"grade":"A","basis":"Serious Seeds directly names Skunk and an Afghan strain as the two parents.","sourceIds":["serious-seeds-warlock"]},"history":{"grade":"A","basis":"Serious Seeds directly documents the Magus Genetics origin and 1997 debut/awards.","sourceIds":["serious-seeds-warlock"]},"aroma":{"grade":"A","basis":"Serious Seeds directly describes strong sweet aroma with acidic and fresh-fruit notes.","sourceIds":["serious-seeds-warlock"]},"terpene":{"grade":"unknown","basis":"The official page mentions several terpene profiles but does not name a cultivar-specific compound panel; no compounds are inferred.","sourceIds":["serious-seeds-warlock"]}},"sources":[{"id":"serious-seeds-warlock","url":"https://www.seriousseeds.com/cannabis-seeds/warlock","payload":{"schemaVersion":1,"id":"serious-seeds-warlock","publisher":"Serious Seeds","title":"Warlock Strain","url":"https://www.seriousseeds.com/cannabis-seeds/warlock","sourceType":"breederOfficial","supports":["lineage","breeder","classification","breeding","aromas","terpenes","origin","history","visualMorphology"],"publishedAt":null,"checkedAt":"2026-08-17","note":"Serious Seeds official cultivar page used for mostly-indica classification, Skunk/Afghani lineage, history, aroma and morphology."}}],"entities":[{"id":"serious-seeds","canonicalName":"Serious Seeds","payload":{"schemaVersion":1,"id":"serious-seeds","name":"Serious Seeds","roles":["breeder","seedCompany"],"checkedAt":"2026-08-14","updatedAt":"2026-08-15","note":"Created from the existing Bubble Gum source attribution during MASTER migration."}}],"duplicateCheck":{"productionChecked":true,"stockChecked":true,"strain":{"key":"id=warlock; canonicalName=Warlock","result":"UNIQUE","reason":"No matching production strain ID/canonical name and no existing STOCK item."},"sources":[{"key":"id=serious-seeds-warlock; url=https://www.seriousseeds.com/cannabis-seeds/warlock","result":"UNIQUE","reason":"No production or existing STOCK source matches this ID or URL."}],"entities":[{"key":"id=serious-seeds; canonicalName=Serious Seeds","result":"MATCH","matchedPath":"entities/serious-seeds.json","reason":"Existing production entity ID and canonical name match; the production payload is reused exactly and no entity file is proposed."}]},"visualStatus":"IMAGE_PENDING","visualPreparation":{"prompt":"Photorealistic botanical reference image of mature flowering Warlock: compact mostly-indica plant with thick growth, oversized compact flower heads, very few small leaves around the flowers, visible resin, and mature pistils transitioning from white toward dark pink where expressed. Natural neutral light, cultivar-focused. No labels, logos, packaging, people or smoke.","evidence":[{"description":"Serious Seeds describes low, thick vegetative growth, then large compact flower heads with few small leaves; white pistils can turn dark pink as flowers mature.","sourceIds":["serious-seeds-warlock"]}],"alt":"Warlockの低く厚みのある株姿、大きなコンパクト花、成熟時に濃い桃色へ変化する雌しべを公式形態情報に基づいて表現したAI生成参考ビジュアル","rights":"AI-generated project asset planned for Cannabis Strain Wisdom; no third-party image will be copied. Visual prompt is derived from cited official morphology evidence.","scope":"cultivar","aiGenerated":true},"visuals":[],"notes":"AUTO STOCK V1 research-only candidate. No image generated and no production data changed."}
