{"schemaVersion":"AUTO_STOCK_V1","stockId":"acapulco-gold","status":"IMAGE_PENDING","createdAt":"2026-08-19T12:46:00Z","candidate":{"id":"acapulco-gold","canonicalName":"Acapulco Gold","strainData":{"schemaVersion":1,"id":"acapulco-gold","status":"review","name":"Acapulco Gold","jp":null,"aliases":[],"classification":{"type":"sativa"},"breeding":{"generation":"unknown","method":"sativa-dominant regular line"},"lineage":{"status":"confirmed","confidence":"A","basis":"breederOfficial","sourceRefs":["barneys-farm-acapulco-gold"],"display":"Central American","parents":["Central American"],"note":"Barney's Farm lists Acapulco Gold Regular as Central American genetics and 70% sativa / 30% indica; no narrower hidden pedigree is inferred."},"relations":[{"entityId":"barneys-farm","roles":["breeder","seedCompany"],"status":"confirmed","confidence":"A","basis":"breederOfficial","sourceRefs":["barneys-farm-acapulco-gold"]}],"aromas":{"status":"confirmed","confidence":"A","basis":"breederOfficial","sourceRefs":["barneys-farm-acapulco-gold"],"items":["earthy","pine","pungent","sweet"],"note":"Official Barney's Farm cultivar descriptors."},"terpenes":{"status":"unknown","items":[],"note":"No named cultivar-specific terpene compound panel was verified from the checked official source; no compounds are inferred from aroma words."},"origin":{"status":"confirmed","confidence":"A","basis":"breederOfficial","sourceRefs":["barneys-farm-acapulco-gold"],"text":"Barney's Farm describes this Acapulco Gold line as derived from Central American/Mexican landrace heritage.","note":"Limited to official breeder/seed-company context; undisclosed details remain undisclosed."},"history":{"status":"confirmed","confidence":"B","basis":"breederOfficial","sourceRefs":["barneys-farm-acapulco-gold"],"text":"The official page presents Acapulco Gold as a legacy Mexican/Acapulco cultivar line; no precise creation date is asserted.","note":"Only bounded history stated by the current official source is retained."},"visuals":[],"checkedAt":"2026-08-19","updatedAt":"2026-08-19"}},"confidence":{"lineage":{"grade":"A","basis":"Barney's Farm lists Acapulco Gold Regular as Central American genetics and 70% sativa / 30% indica; no narrower hidden pedigree is inferred.","sourceIds":["barneys-farm-acapulco-gold"]},"history":{"grade":"B","basis":"Official breeder/seed-company page provides bounded cultivar history but not a complete independent chronology.","sourceIds":["barneys-farm-acapulco-gold"]},"aroma":{"grade":"A","basis":"Official Barney's Farm cultivar descriptors.","sourceIds":["barneys-farm-acapulco-gold"]},"terpene":{"grade":"unknown","basis":"No named cultivar-specific terpene compound panel was verified from the checked official source.","sourceIds":["barneys-farm-acapulco-gold"]}},"sources":[{"id":"barneys-farm-acapulco-gold","url":"https://www.barneysfarm.us/acapulco-gold-_-regular-seeds-845","payload":{"schemaVersion":1,"id":"barneys-farm-acapulco-gold","publisher":"Barney's Farm","title":"Acapulco Gold","url":"https://www.barneysfarm.us/acapulco-gold-_-regular-seeds-845","sourceType":"breederOfficial","supports":["lineage","breeder","classification","breeding","aromas","origin","history","visualMorphology"],"publishedAt":null,"checkedAt":"2026-08-19","note":"Official cultivar page used for identity, breeding/lineage and text-grounded morphology. The page exposes cultivar imagery, but the visual pixels were not retrievable in a sufficiently inspectable form in this run, so no image-derived morphology is claimed."}}],"entities":[{"id":"barneys-farm","canonicalName":"Barney's Farm","payload":{"schemaVersion":1,"id":"barneys-farm","name":"Barney's Farm","roles":["breeder","seedCompany"],"status":"confirmed","checkedAt":"2026-08-17","updatedAt":"2026-08-17"}}],"duplicateCheck":{"productionChecked":true,"stockChecked":true,"strain":{"key":"id=acapulco-gold; canonicalName=Acapulco Gold; normalizedBaseCultivar=acapulcogold","result":"UNIQUE","reason":"DIVERSITY-FIRST novelty preflight at master-migration cd60b6ebf9675022a6f0b84ff7f226cba11340b2: exact canonical/id, normalized base-family, spelling/punctuation/generation variant and alias checks are all NO against strains, publication/runtime, active production targets, image backlog and pre-existing stock. Adds a Central American/Acapulco base cultivar with gold and reddish-brown flower cues, distinct from existing African/Thai and Kush-heavy families."},"sources":[{"key":"id=barneys-farm-acapulco-gold; url=https://www.barneysfarm.us/acapulco-gold-_-regular-seeds-845","result":"UNIQUE","reason":"No existing production/stock source with this exact source ID or official URL was identified in the preflight."}],"entities":[{"key":"id=barneys-farm; canonicalName=Barney's Farm","result":"MATCH","matchedPath":"entities/barneys-farm.json","reason":"Existing production entity ID/canonical name matches; exact entity payload is reused and no entity file is proposed."}]},"visualStatus":"IMAGE_PENDING","visualPreparation":{"prompt":"TEXT-EVIDENCE FALLBACK: the breeder-operated cultivar page exposes cultivar-specific imagery, but the visual pixels were not retrievable in this run in a form sufficient for trustworthy image-derived morphology extraction. Use only the official text morphology evidence below; evidence alignment is NOT_APPLICABLE.\nCULTIVAR IDENTITY CONTEXT: Acapulco Gold by Barney's Farm; Central American; sativa-dominant regular line.\nTEXT MORPHOLOGY EVIDENCE: medium indoor to taller outdoor plant; thick colas; distinctive reddish-brown calyx/pistil coloration; green-and-gold flower tones; abundant visible resin; do not infer finer architecture not stated in the official text.\nPHOTOGRAPHIC CONSTRAINTS: photorealistic botanical reference photography; one mature flowering female cannabis plant; complete plant visible; neutral natural light; neutral non-distracting background; realistic botany; no text; no collage.\nNEGATIVE CONSTRAINTS: no fruit or berries; no people; no labels or logos; no jars, bags, boxes or bottles; no smoke; no unrelated objects; no fantasy anatomy; do not add cultivar-specific morphology beyond the cited official text evidence.","evidence":[{"description":"[EVIDENCE_ALIGNMENT=NOT_APPLICABLE] Official cultivar imagery is present on the breeder-operated page, but its pixels were not retrievable in this run in a form sufficient for trustworthy visual morphology extraction. No image-derived claims are made; all non-alignment AI visual QA gates remain required.","sourceIds":["barneys-farm-acapulco-gold"]},{"description":"Official text morphology evidence: medium indoor to taller outdoor plant; thick colas; distinctive reddish-brown calyx/pistil coloration; green-and-gold flower tones; abundant visible resin; do not infer finer architecture not stated in the official text.","sourceIds":["barneys-farm-acapulco-gold"]}],"alt":"Acapulco GoldのBarney's Farm公式テキスト形態情報を基礎に、未確認の画像由来形態を付加せず作成するAI生成参考ビジュアル","rights":"AI-generated project asset for Cannabis Strain Wisdom. No official or third-party image is copied or stored; prompt uses official text evidence only because visual retrieval was insufficient for image-derived morphology.","scope":"cultivar","aiGenerated":true},"visuals":[],"notes":"DIVERSITY-FIRST / NO NEAR-DUPLICATE FIVE. normalizedBaseCultivar=acapulcogold; exact/base-family/alias collision=NO at preflight; official visual evidence=INSUFFICIENT for image-derived extraction, so text-grounded fallback is used."}