{"schemaVersion":"AUTO_STOCK_V1","stockId":"california-orange-s1","status":"IMAGE_PENDING","createdAt":"2026-08-19T07:50:00Z","candidate":{"id":"california-orange-s1","canonicalName":"California Orange S1","strainData":{"schemaVersion":1,"id":"california-orange-s1","status":"review","name":"California Orange S1","jp":null,"aliases":[],"classification":{"type":"unknown"},"breeding":{"generation":"S1","method":"selfed"},"lineage":{"status":"confirmed","confidence":"A","basis":"breederOfficial","sourceRefs":["humboldt-csi-california-orange-s1"],"display":"California Orange (AE77 cut) × California Orange (AE77 cut)","parents":["California Orange (AE77 cut)"],"note":"Humboldt CSI's official California Orange S1 page lists the cultivar as California Orange (AE77 cut) × California Orange (AE77 cut). Together with the official S1 designation, this is treated as a selfed S1 line. No unstated ancestry is copied from the parent cultivar."},"relations":[{"entityId":"humboldt-csi","roles":["breeder","seedCompany"],"status":"confirmed","confidence":"A","basis":"breederOfficial","sourceRefs":["humboldt-csi-california-orange-s1"]}],"aromas":{"status":"unknown","items":[],"note":"The official California Orange S1 product page does not provide cultivar-level aroma descriptors; parent-cultivar or customer-review aromas are not generalized to this S1 line."},"terpenes":{"status":"unknown","items":[],"note":"The official California Orange S1 product page does not provide a cultivar-specific terpene profile or lot COA."},"origin":{"status":"unknown","text":"","note":"The official California Orange S1 product page does not state the S1 line's exact creation location; no inferred location is added."},"history":{"status":"unknown","text":"","note":"The official California Orange S1 product page does not state a cultivar-specific release date or development history; no secondary history is imported."},"visuals":[],"checkedAt":"2026-08-19","updatedAt":"2026-08-19"}},"confidence":{"lineage":{"grade":"A","basis":"Humboldt CSI directly identifies California Orange S1 as an S1 and lists the same cultivar on both sides of the cross.","sourceIds":["humboldt-csi-california-orange-s1"]},"history":{"grade":"unknown","basis":"No cultivar-specific release/development history is stated on the official product page."},"aroma":{"grade":"unknown","basis":"No cultivar-level aroma descriptors are stated on the official product page."},"terpene":{"grade":"unknown","basis":"No cultivar-specific terpene profile or lot COA is stated on the official product page."}},"sources":[{"id":"humboldt-csi-california-orange-s1","url":"https://humboldtcsi.com/product/california-orange-s1/","payload":{"schemaVersion":1,"id":"humboldt-csi-california-orange-s1","publisher":"Humboldt CSI","title":"California Orange S1","url":"https://humboldtcsi.com/product/california-orange-s1/","sourceType":"breederOfficial","supports":["lineage","breeder","generation","breeding"],"publishedAt":null,"checkedAt":"2026-08-19","note":"Official Humboldt CSI product page used to confirm the California Orange S1 identity, S1 designation, same-cultivar cross (California Orange (AE77 cut) × California Orange (AE77 cut)), feminized seed listing, and Humboldt CSI association. No unsupported aroma, terpene, classification, or cultivar-wide morphology claims are imported."}}],"entities":[{"id":"humboldt-csi","canonicalName":"Humboldt CSI","payload":{"schemaVersion":1,"id":"humboldt-csi","name":"Humboldt CSI","roles":["breeder","seedCompany"],"status":"confirmed","checkedAt":"2026-08-16","updatedAt":"2026-08-16"}}],"duplicateCheck":{"productionChecked":true,"stockChecked":true,"strain":{"key":"id=california-orange-s1; canonicalName=California Orange S1","result":"UNIQUE","reason":"No matching production strain ID/canonical name, publication entry, or existing STOCK item at the checked master-migration HEAD."},"sources":[{"key":"id=humboldt-csi-california-orange-s1; url=https://humboldtcsi.com/product/california-orange-s1/","result":"UNIQUE","reason":"No existing production or STOCK source uses this source ID or exact official URL."}],"entities":[{"key":"id=humboldt-csi; canonicalName=Humboldt CSI","result":"MATCH","matchedPath":"entities/humboldt-csi.json","reason":"Existing production entity ID and canonical name match; the production entity payload is reused exactly and no entity file is proposed."}]},"visualStatus":"IMAGE_PENDING","visualPreparation":{"prompt":"Photorealistic botanical reference image of one mature flowering cannabis plant representing California Orange S1, complete plant visible, neutral natural light, realistic botany. Do not assert cultivar-specific architecture, branching pattern, internode spacing, leaf width, flower shape, flower density, coloration, or resin/trichome intensity beyond ordinary natural cannabis morphology because the official cultivar page does not provide verified morphology evidence. No labels, logos, packaging, people, smoke, consumption context, text, or invented signature coloration.","evidence":[{"description":"Humboldt CSI's official California Orange S1 page confirms cultivar identity and S1/selfed parentage but provides no verified cultivar-wide architecture, branching, internode, leaf-width, flower-density, color, or resin morphology descriptors. The generation prompt therefore intentionally avoids cultivar-specific morphology claims.","sourceIds":["humboldt-csi-california-orange-s1"]}],"alt":"California Orange S1の公式S1同定情報を基礎に、未確認の品種固有形態を付加せず作成するAI生成の植物学的参考ビジュアル","rights":"AI-generated project asset for Cannabis Strain Wisdom. No third-party image is copied; the prompt is constrained to claims supported by the cited official cultivar page.","scope":"cultivar","aiGenerated":true},"visuals":[],"notes":"AUTO STOCK V1 candidate prepared for S1 five-cultivar production. Official breeder source confirms S1/selfed identity; unsupported parent traits are not copied. No image generated in stock preparation."}