{
  "schemaVersion":"AUTO_STOCK_V1","stockId":"triangle-kush-s1","status":"IMAGE_PENDING","createdAt":"2026-08-19T10:32:00Z",
  "candidate":{"id":"triangle-kush-s1","canonicalName":"Triangle Kush S1","strainData":{"schemaVersion":1,"id":"triangle-kush-s1","status":"review","name":"Triangle Kush S1","jp":null,"aliases":[],"classification":{"type":"unknown"},"breeding":{"generation":"S1","method":"selfed"},"lineage":{"status":"confirmed","confidence":"A","basis":"breederOfficial","sourceRefs":["humboldt-csi-triangle-kush-s1"],"display":"Triangle Kush × Triangle Kush","parents":["Triangle Kush"],"note":"Humboldt CSI's official product page identifies Triangle Kush S1 as Triangle Kush × Triangle Kush; together with the S1 designation this is treated as a selfed S1 line."},"relations":[{"entityId":"humboldt-csi","roles":["breeder","seedCompany"],"status":"confirmed","confidence":"A","basis":"breederOfficial","sourceRefs":["humboldt-csi-triangle-kush-s1"]}],"aromas":{"status":"unknown","items":[],"note":"No cultivar-wide aroma claim is added beyond the official source."},"terpenes":{"status":"unknown","items":[],"note":"No cultivar-specific lot terpene profile or COA is used for this S1 entry."},"origin":{"status":"unknown","text":"","note":"The official page does not establish a sufficiently bounded creation location for this S1 line; no location is inferred."},"history":{"status":"confirmed","confidence":"B","basis":"breederOfficial","sourceRefs":["humboldt-csi-triangle-kush-s1"],"text":"Humboldt CSI describes repeated reversals of its Triangle Kush mother cut over roughly four years before successfully producing this S1 seed release.","note":"The official page provides breeder-process context but not a precise calendar release date."},"visuals":[],"checkedAt":"2026-08-19","updatedAt":"2026-08-19"}},
  "confidence":{"lineage":{"grade":"A","basis":"Humboldt CSI directly identifies Triangle Kush S1 as an S1 and lists Triangle Kush on both sides of the cross.","sourceIds":["humboldt-csi-triangle-kush-s1"]},"history":{"grade":"B","basis":"The official page provides breeder-process context but not a precise calendar release date.","sourceIds":["humboldt-csi-triangle-kush-s1"]},"aroma":{"grade":"unknown","basis":"No cultivar-wide aroma claim is added from the official page."},"terpene":{"grade":"unknown","basis":"No cultivar-specific lot terpene profile or COA is available for the S1 line."}},
  "sources":[{"id":"humboldt-csi-triangle-kush-s1","url":"https://www.humboldtcsi.com/product/triangle-kush-s1/","payload":{"schemaVersion":1,"id":"humboldt-csi-triangle-kush-s1","publisher":"Humboldt CSI","title":"Triangle Kush S1","url":"https://www.humboldtcsi.com/product/triangle-kush-s1/","sourceType":"breederOfficial","supports":["lineage","breeder","generation","breeding","history","visualMorphology"],"publishedAt":null,"checkedAt":"2026-08-19","note":"Official Humboldt CSI product page used for S1 identity, breeder context, and bounded cultivar-specific visual morphology; no source image is copied into the repository."}}],
  "entities":[{"id":"humboldt-csi","canonicalName":"Humboldt CSI","payload":{"schemaVersion":1,"id":"humboldt-csi","name":"Humboldt CSI","roles":["breeder","seedCompany"],"status":"confirmed","checkedAt":"2026-08-16","updatedAt":"2026-08-16"}}],
  "duplicateCheck":{"productionChecked":true,"stockChecked":true,"strain":{"key":"id=triangle-kush-s1; canonicalName=Triangle Kush S1","result":"UNIQUE","reason":"No matching production strain ID/canonical name, publication entry, or existing STOCK item at the checked master-migration HEAD."},"sources":[{"key":"id=humboldt-csi-triangle-kush-s1; url=https://www.humboldtcsi.com/product/triangle-kush-s1/","result":"UNIQUE","reason":"No existing production or STOCK source uses this source ID or exact official URL."}],"entities":[{"key":"id=humboldt-csi; canonicalName=Humboldt CSI","result":"MATCH","matchedPath":"entities/humboldt-csi.json","reason":"Existing production entity ID and canonical name match; the production entity payload is reused exactly."}]},
  "visualStatus":"IMAGE_PENDING",
  "visualPreparation":{"prompt":"CULTIVAR-SPECIFIC VISUAL EVIDENCE (highest priority): the official Triangle Kush S1 reference shows a dense chunky multi-lobed flower cluster, medium-to-broad serrated deep-green leaves, very heavy visible trichome coverage, and orange-rust pistils. Do not infer whole-plant silhouette, branching pattern, or internode spacing from this close-up reference.\nCULTIVAR IDENTITY CONTEXT: Triangle Kush S1 by Humboldt CSI; S1/selfed generation; Triangle Kush × Triangle Kush.\nPHOTOGRAPHIC CONSTRAINTS: photorealistic botanical reference photography; single mature female cannabis plant; complete plant visible; natural light; neutral non-distracting background; no text; no collage; no packaging; no smoke.\nNEGATIVE CONSTRAINTS: no fruit or berries; no people; no labels or logos; no jars, bags, boxes or bottles; no smoke; no unrelated objects; no fantasy anatomy; do not invent cultivar-specific whole-plant architecture where the reference does not show it.","evidence":[{"description":"[EVIDENCE_ALIGNMENT=REQUIRED] OFFICIAL_VISUAL_EVIDENCE: Close-up reference shows a dense chunky flower cluster, medium-to-broad serrated green leaves, very heavy visible trichome coverage, and orange-rust pistils. Whole-plant silhouette, branching pattern, and internode spacing are not observable.","sourceIds":["humboldt-csi-triangle-kush-s1"]},{"description":"The official cultivar page identifies Triangle Kush × Triangle Kush and provides a cultivar-specific flower image; extraction is limited to flower, leaf, color and trichome traits visible in that image.","sourceIds":["humboldt-csi-triangle-kush-s1"]}],"alt":"Triangle Kush S1の根拠範囲を明示したAI生成の植物学的参考ビジュアル","rights":"AI-generated project asset for Cannabis Strain Wisdom. No official or third-party image is copied or stored; only bounded morphology evidence is used.","scope":"cultivar","aiGenerated":true},"visuals":[],"notes":"AUTO STOCK V1 candidate prepared for OFFICIAL VISUAL EVIDENCE V1. No reference image bytes are stored in the repository."
}
