{"schemaVersion":"AUTO_STOCK_V1","stockId":"killer-a5-haze","status":"IMAGE_PENDING","createdAt":"2026-08-21T19:49:07Z","candidate":{"id":"killer-a5-haze","canonicalName":"Killer A5 Haze","strainData":{"schemaVersion":1,"id":"killer-a5-haze","status":"review","name":"Killer A5 Haze","jp":null,"aliases":[],"classification":{"type":"sativa-dominant-hybrid"},"breeding":{"generation":"other","method":"poly hybrid"},"lineage":{"status":"confirmed","confidence":"A","basis":"breederOfficial","sourceRefs":["ace-seeds-killer-a5-haze"],"display":"A5 Haze by Neville (Northern Lights #5/Haze A) × Malawi Killer","parents":["A5 Haze by Neville","Malawi Killer"],"note":"ACE Seeds explicitly identifies Killer A5 Haze as A5 Haze by Neville (Northern Lights #5/Haze A) crossed with Malawi Killer."},"relations":[{"entityId":"ace-seeds","roles":["breeder","seedCompany"],"status":"confirmed","confidence":"A","basis":"breederOfficial","sourceRefs":["ace-seeds-killer-a5-haze"]}],"aromas":{"status":"confirmed","confidence":"A","basis":"breederOfficial","sourceRefs":["ace-seeds-killer-a5-haze"],"items":["dark incense","meaty/liver","organic/rotten","decomposing flower petals","resin","cured wood"],"note":"Cultivar-specific bouquet descriptors normalized from the ACE Seeds official page without inferring chemical compounds."},"terpenes":{"status":"confirmed","confidence":"B","basis":"breederOfficial","sourceRefs":["ace-seeds-killer-a5-haze"],"items":["beta-myrcene","alpha-pinene","limonene","beta-pinene","ocimene","cis-beta-farnesene","beta-caryophyllene","trans-phytol","alpha-bisabolol","guaiol","trans-nerolidol","beta-farnesene","alpha-farnesene"],"note":"ACE Seeds publishes a named cultivar-specific terpene profile; confidence remains below A because an independently retrieved laboratory report is not used here."},"origin":{"status":"unknown","text":"","note":"The cited official cultivar evidence does not establish a sufficiently bounded creation location for this atlas entry; no location is inferred."},"history":{"status":"confirmed","confidence":"B","basis":"breederOfficial","sourceRefs":["ace-seeds-about"],"text":"ACE Seeds states that its 2019 collaboration with Yo Sammy produced its first fruits including Killer A5 Haze (A5 Haze x Malawi).","note":"Only chronology or development context explicitly stated by ACE Seeds is retained; unstated dates are not inferred."},"publicContent":{"ja":{"lineageNote":"Killer A5 Hazeは、Nevilleが選抜したA5 Haze（Northern Lights #5 × Haze A）に、ACE SeedsのMalawi Killerを交配したポリハイブリッドとして公式に記載されています。","history":"ACE Seedsは、Yo Sammyとの協働が始まった2019年の最初の成果の一つとしてKiller A5 Haze（A5 Haze × Malawi）を挙げています。現行の公式沿革で確認できる範囲に限定した開発背景です。","aromaNote":"公式説明では、暗いインセンス系Hazeを軸に、肉やレバーを思わせる濃さ、樹脂、熟成木材、分解した花弁を連想させる有機的なニュアンスが重なる香りとして示されています。","terpeneNote":"ACE Seeds公式の品種別情報では、beta-myrceneが非常に多く、alpha-pineneが中程度、limoneneとbeta-pineneがそれに続くとされます。さらにbeta-caryophyllene、guaiol、trans-nerolidolなど複数のセスキテルペンも列挙されています。"}},"visuals":[],"checkedAt":"2026-08-22","updatedAt":"2026-08-22"}},"confidence":{"lineage":{"grade":"A","basis":"ACE Seeds official cultivar page directly states the parentage or preserved pure-line identity.","sourceIds":["ace-seeds-killer-a5-haze"]},"history":{"grade":"B","basis":"ACE Seeds official cultivar/history material provides bounded development or release context.","sourceIds":["ace-seeds-about"]},"aroma":{"grade":"A","basis":"ACE Seeds official cultivar page provides cultivar-specific bouquet descriptors.","sourceIds":["ace-seeds-killer-a5-haze"]},"terpene":{"grade":"B","basis":"ACE Seeds official cultivar page publishes a named cultivar-specific terpene profile; no independent lab report is promoted to this claim.","sourceIds":["ace-seeds-killer-a5-haze"]}},"sources":[{"id":"ace-seeds-killer-a5-haze","url":"https://www.aceseeds.org/en/seeds/killer-a5-haze-regular-seeds/","payload":{"schemaVersion":1,"id":"ace-seeds-killer-a5-haze","publisher":"ACE Seeds","title":"Killer A5 Haze Regular","url":"https://www.aceseeds.org/en/seeds/killer-a5-haze-regular-seeds/","sourceType":"breederOfficial","supports":["lineage","breeder","classification","breeding","aromas","terpenes","visualMorphology"],"publishedAt":null,"checkedAt":"2026-08-22","note":"ACE Seeds official cultivar page used for the Killer A5 Haze production-ready stock candidate: lineage, classification/breeding context, cultivar-specific structure, bouquet and named terpene profile."}},{"id":"ace-seeds-about","url":"https://www.aceseeds.org/en/content/6-about-us","payload":{"schemaVersion":1,"id":"ace-seeds-about","publisher":"ACE Seeds","title":"About Us","url":"https://www.aceseeds.org/en/content/6-about-us","sourceType":"breederOfficial","supports":["breeder","history"],"publishedAt":null,"checkedAt":"2026-08-17","note":"ACE Seeds公式沿革・entity確認。2012年のMalawi導入とACE Seedsのbreeder / seed company確認に使用。"}}],"entities":[{"id":"ace-seeds","canonicalName":"ACE Seeds","payload":{"schemaVersion":1,"id":"ace-seeds","name":"ACE Seeds","roles":["breeder","seedCompany"],"status":"confirmed","checkedAt":"2026-08-17","updatedAt":"2026-08-17"}}],"duplicateCheck":{"productionChecked":true,"stockChecked":true,"strain":{"key":"id=killer-a5-haze; canonicalName=Killer A5 Haze","result":"UNIQUE","reason":"Fresh repository code search and current strains/STOCK/publication checks found no matching cultivar ID, canonical name or alias-equivalent candidate."},"sources":[{"key":"id=ace-seeds-killer-a5-haze; url=https://www.aceseeds.org/en/seeds/killer-a5-haze-regular-seeds/","result":"UNIQUE","reason":"No existing production or STOCK source uses this source ID or exact official URL at the checked master-migration HEAD."},{"key":"id=ace-seeds-about; url=https://www.aceseeds.org/en/content/6-about-us","result":"MATCH","matchedPath":"sources/ace-seeds-about.json","reason":"Existing production source matches exactly and is reused for ACE Seeds official history context."}],"entities":[{"key":"id=ace-seeds; canonicalName=ACE Seeds","result":"MATCH","matchedPath":"entities/ace-seeds.json","reason":"Existing production ACE Seeds entity is reused exactly; no entity overwrite is proposed."}]},"visualStatus":"IMAGE_PENDING","visualPreparation":{"prompt":"Photorealistic botanical reference image of one mature flowering Killer A5 Haze cannabis plant. Show a vigorous branched sativa-dominant structure with medium internode spacing and a contained, manageable overall size; mature flower clusters may show the substantial cola development and resinous Haze/Malawi character described by ACE Seeds, without selecting one phenotype as universal. Natural botanical lighting, complete plant visible. Do not copy source photography, add labels, people, smoke, or invent unsupported color traits.","evidence":[{"description":"Branched sativa structure with medium internode distance, contained manageable size; phenotype descriptions include large colas, strong flower-to-leaf ratio and resinous expressions.","sourceIds":["ace-seeds-killer-a5-haze"]}],"alt":"Killer A5 Hazeの枝分かれしたサティバ優勢構造と中程度の節間、成熟した花房を公式形態情報に基づいて表現するAI生成参考ビジュアル","rights":"AI-generated project asset for Cannabis Strain Wisdom. No third-party image is copied; the prompt is constrained to cultivar-specific morphology supported by the cited official ACE Seeds source.","scope":"cultivar","aiGenerated":true},"visuals":[],"notes":"AUTO STOCK V1 production-ready candidate. Formal evidence and required Japanese publicContent were completed in the same stock-building pass. Image remains pending; no image was generated."}