{"schemaVersion":"AUTO_STOCK_V1","stockId":"violeta","status":"IMAGE_PENDING","createdAt":"2026-08-21T19:49:07Z","candidate":{"id":"violeta","canonicalName":"Violeta","strainData":{"schemaVersion":1,"id":"violeta","status":"review","name":"Violeta","jp":null,"aliases":[],"classification":{"type":"indica-dominant-hybrid"},"breeding":{"generation":"F1","method":"F1 hybrid"},"lineage":{"status":"confirmed","confidence":"A","basis":"breederOfficial","sourceRefs":["ace-seeds-violeta"],"display":"Purple Malawi × Purple Pakistan Chitral Kush","parents":["Purple Malawi","Purple Pakistan Chitral Kush"],"note":"ACE Seeds describes Violeta as an F1 hybrid from Purple Malawi crossed with Purple Pakistan Chitral Kush."},"relations":[{"entityId":"ace-seeds","roles":["breeder","seedCompany"],"status":"confirmed","confidence":"A","basis":"breederOfficial","sourceRefs":["ace-seeds-violeta"]}],"aromas":{"status":"confirmed","confidence":"A","basis":"breederOfficial","sourceRefs":["ace-seeds-violeta"],"items":["balsamic","forest fruits"],"note":"Cultivar-specific bouquet descriptors normalized from the ACE Seeds official page without inferring chemical compounds."},"terpenes":{"status":"confirmed","confidence":"B","basis":"breederOfficial","sourceRefs":["ace-seeds-violeta"],"items":["terpinolene","alpha-pinene","limonene","beta-pinene","trans-ocimene","linalool","beta-myrcene","beta-caryophyllene","guaiol","alpha-humulene"],"note":"ACE Seeds publishes a named cultivar-specific terpene profile; confidence remains below A because an independently retrieved laboratory report is not used here."},"origin":{"status":"unknown","text":"","note":"The cited official cultivar evidence does not establish a sufficiently bounded creation location for this atlas entry; no location is inferred."},"history":{"status":"confirmed","confidence":"B","basis":"breederOfficial","sourceRefs":["ace-seeds-about"],"text":"ACE Seeds states that Violeta was released in 2014.","note":"Only chronology or development context explicitly stated by ACE Seeds is retained; unstated dates are not inferred."},"publicContent":{"ja":{"lineageNote":"Violetaは、Purple Malawiを母系に、紫色のPakistan Chitral Kushを交配したF1ハイブリッドとしてACE Seedsが公式に説明しています。","history":"ACE Seedsの公式沿革では、Violetaは2014年にリリースされた品種として記録されています。ここではその明記された年だけを履歴として採用しています。","aromaNote":"公式の品種説明では、バルサミックな香りを中心に、森の果実を思わせるフルーティーな背景が重なるとされています。","terpeneNote":"公式テルペン欄ではterpinoleneが35%と最も多く、alpha-pinene、limonene、beta-pineneが続き、trans-ocimene、linalool、beta-myrceneも少量記載されています。セスキテルペンとしてbeta-caryophyllene、guaiol、alpha-humuleneが挙げられています。"}},"visuals":[],"checkedAt":"2026-08-22","updatedAt":"2026-08-22"}},"confidence":{"lineage":{"grade":"A","basis":"ACE Seeds official cultivar page directly states the parentage or preserved pure-line identity.","sourceIds":["ace-seeds-violeta"]},"history":{"grade":"B","basis":"ACE Seeds official cultivar/history material provides bounded development or release context.","sourceIds":["ace-seeds-about"]},"aroma":{"grade":"A","basis":"ACE Seeds official cultivar page provides cultivar-specific bouquet descriptors.","sourceIds":["ace-seeds-violeta"]},"terpene":{"grade":"B","basis":"ACE Seeds official cultivar page publishes a named cultivar-specific terpene profile; no independent lab report is promoted to this claim.","sourceIds":["ace-seeds-violeta"]}},"sources":[{"id":"ace-seeds-violeta","url":"https://www.aceseeds.org/en/seeds/violeta-regular-seeds/","payload":{"schemaVersion":1,"id":"ace-seeds-violeta","publisher":"ACE Seeds","title":"Violeta Regular","url":"https://www.aceseeds.org/en/seeds/violeta-regular-seeds/","sourceType":"breederOfficial","supports":["lineage","breeder","classification","breeding","aromas","terpenes","visualMorphology"],"publishedAt":null,"checkedAt":"2026-08-22","note":"ACE Seeds official cultivar page used for the Violeta production-ready stock candidate: lineage, classification/breeding context, cultivar-specific structure, bouquet and named terpene profile."}},{"id":"ace-seeds-about","url":"https://www.aceseeds.org/en/content/6-about-us","payload":{"schemaVersion":1,"id":"ace-seeds-about","publisher":"ACE Seeds","title":"About Us","url":"https://www.aceseeds.org/en/content/6-about-us","sourceType":"breederOfficial","supports":["breeder","history"],"publishedAt":null,"checkedAt":"2026-08-17","note":"ACE Seeds公式沿革・entity確認。2012年のMalawi導入とACE Seedsのbreeder / seed company確認に使用。"}}],"entities":[{"id":"ace-seeds","canonicalName":"ACE Seeds","payload":{"schemaVersion":1,"id":"ace-seeds","name":"ACE Seeds","roles":["breeder","seedCompany"],"status":"confirmed","checkedAt":"2026-08-17","updatedAt":"2026-08-17"}}],"duplicateCheck":{"productionChecked":true,"stockChecked":true,"strain":{"key":"id=violeta; canonicalName=Violeta","result":"UNIQUE","reason":"Fresh repository code search and current strains/STOCK/publication checks found no matching cultivar ID, canonical name or alias-equivalent candidate."},"sources":[{"key":"id=ace-seeds-violeta; url=https://www.aceseeds.org/en/seeds/violeta-regular-seeds/","result":"UNIQUE","reason":"No existing production or STOCK source uses this source ID or exact official URL at the checked master-migration HEAD."},{"key":"id=ace-seeds-about; url=https://www.aceseeds.org/en/content/6-about-us","result":"MATCH","matchedPath":"sources/ace-seeds-about.json","reason":"Existing production source matches exactly and is reused for ACE Seeds official history context."}],"entities":[{"key":"id=ace-seeds; canonicalName=ACE Seeds","result":"MATCH","matchedPath":"entities/ace-seeds.json","reason":"Existing production ACE Seeds entity is reused exactly; no entity overwrite is proposed."}]},"visualStatus":"IMAGE_PENDING","visualPreparation":{"prompt":"Photorealistic botanical reference image of one mature flowering Violeta cannabis plant. Show the strong, robust, compact architecture and good branching described by ACE Seeds, with mature foliage and flowers capable of expressing the cultivar's documented purple and reddish coloration. Keep coloration natural and variable rather than uniform. Complete plant visible under neutral botanical light. Do not copy source photography, add labels, people, smoke, or exaggerate unsupported morphology.","evidence":[{"description":"Strong, robust and compact plant with good branching; the cultivar is described as maturing with intense purple and reddish colors.","sourceIds":["ace-seeds-violeta"]}],"alt":"Violetaの頑健でコンパクトな分枝構造と、公式に記載された紫から赤系の成熟色を自然な範囲で表現するAI生成参考ビジュアル","rights":"AI-generated project asset for Cannabis Strain Wisdom. No third-party image is copied; the prompt is constrained to cultivar-specific morphology supported by the cited official ACE Seeds source.","scope":"cultivar","aiGenerated":true},"visuals":[],"notes":"AUTO STOCK V1 production-ready candidate. Formal evidence and required Japanese publicContent were completed in the same stock-building pass. Image remains pending; no image was generated."}