{"schemaVersion":"AUTO_STOCK_V1","stockId":"golden-tiger","status":"IMAGE_PENDING","createdAt":"2026-08-19T12:46:00Z","candidate":{"id":"golden-tiger","canonicalName":"Golden Tiger","strainData":{"schemaVersion":1,"id":"golden-tiger","status":"review","name":"Golden Tiger","jp":null,"aliases":[],"classification":{"type":"sativa"},"breeding":{"generation":"F3","method":"semi-stabilized 100% sativa hybrid"},"lineage":{"status":"confirmed","confidence":"A","basis":"breederOfficial","sourceRefs":["ace-seeds-golden-tiger"],"display":"Old Malawi Killer × Koh Chang Thai × Hmong Thai × 3rd-generation Malawi male","parents":["Old Malawi Killer","Koh Chang Thai","Hmong Thai","3rd-generation Malawi male"],"note":"ACE Seeds identifies the current Golden Tiger as an F3 semi-stabilized 100% sativa hybrid combining two Thai lines and two Malawi parental plants."},"relations":[{"entityId":"ace-seeds","roles":["breeder","seedCompany"],"status":"confirmed","confidence":"A","basis":"breederOfficial","sourceRefs":["ace-seeds-golden-tiger"]}],"aromas":{"status":"unknown","items":[],"note":"The checked official page mentions refined aromas but the retrieved source text does not provide a bounded cultivar-specific descriptor list; no aroma notes are inferred."},"terpenes":{"status":"unknown","items":[],"note":"No named cultivar-specific terpene compound panel was verified from the checked official source; no compounds are inferred from aroma words."},"origin":{"status":"confirmed","confidence":"A","basis":"breederOfficial","sourceRefs":["ace-seeds-golden-tiger"],"text":"Developed by ACE Seeds from Malawi and Thai parental lines.","note":"Limited to official breeder/seed-company context; undisclosed details remain undisclosed."},"history":{"status":"confirmed","confidence":"B","basis":"breederOfficial","sourceRefs":["ace-seeds-golden-tiger"],"text":"ACE Seeds describes the current version as a stronger-Thai-influence refinement of Golden Tiger and labels it F3 semi-stabilized.","note":"Only bounded history stated by the current official source is retained."},"visuals":[],"checkedAt":"2026-08-19","updatedAt":"2026-08-19"}},"confidence":{"lineage":{"grade":"A","basis":"ACE Seeds identifies the current Golden Tiger as an F3 semi-stabilized 100% sativa hybrid combining two Thai lines and two Malawi parental plants.","sourceIds":["ace-seeds-golden-tiger"]},"history":{"grade":"B","basis":"Official breeder/seed-company page provides bounded cultivar history but not a complete independent chronology.","sourceIds":["ace-seeds-golden-tiger"]},"aroma":{"grade":"unknown","basis":"The checked official page mentions refined aromas but the retrieved source text does not provide a bounded cultivar-specific descriptor list; no aroma notes are inferred."},"terpene":{"grade":"unknown","basis":"No named cultivar-specific terpene compound panel was verified from the checked official source.","sourceIds":["ace-seeds-golden-tiger"]}},"sources":[{"id":"ace-seeds-golden-tiger","url":"https://www.aceseeds.org/en/seeds/golden-tiger-regular-seeds/","payload":{"schemaVersion":1,"id":"ace-seeds-golden-tiger","publisher":"ACE Seeds","title":"Golden Tiger","url":"https://www.aceseeds.org/en/seeds/golden-tiger-regular-seeds/","sourceType":"breederOfficial","supports":["lineage","breeder","classification","breeding","aromas","origin","history","visualMorphology"],"publishedAt":null,"checkedAt":"2026-08-19","note":"Official cultivar page used for identity, breeding/lineage and text-grounded morphology. The page exposes cultivar imagery, but the visual pixels were not retrievable in a sufficiently inspectable form in this run, so no image-derived morphology is claimed."}}],"entities":[{"id":"ace-seeds","canonicalName":"ACE Seeds","payload":{"schemaVersion":1,"id":"ace-seeds","name":"ACE Seeds","roles":["breeder","seedCompany"],"status":"confirmed","checkedAt":"2026-08-17","updatedAt":"2026-08-17"}}],"duplicateCheck":{"productionChecked":true,"stockChecked":true,"strain":{"key":"id=golden-tiger; canonicalName=Golden Tiger; normalizedBaseCultivar=goldentiger","result":"UNIQUE","reason":"DIVERSITY-FIRST novelty preflight at master-migration cd60b6ebf9675022a6f0b84ff7f226cba11340b2: exact canonical/id, normalized base-family, spelling/punctuation/generation variant and alias checks are all NO against strains, publication/runtime, active production targets, image backlog and pre-existing stock. Adds a new tropical 100% sativa base family built from Malawi and Thai lines; distinct from existing Malawi, Zamaldelica and Bangi Haze because the canonical/base cultivar itself is Golden Tiger, not a generation of those entries."},"sources":[{"key":"id=ace-seeds-golden-tiger; url=https://www.aceseeds.org/en/seeds/golden-tiger-regular-seeds/","result":"UNIQUE","reason":"No existing production/stock source with this exact source ID or official URL was identified in the preflight."}],"entities":[{"key":"id=ace-seeds; canonicalName=ACE Seeds","result":"MATCH","matchedPath":"entities/ace-seeds.json","reason":"Existing production entity ID/canonical name matches; exact entity payload is reused and no entity file is proposed."}]},"visualStatus":"IMAGE_PENDING","visualPreparation":{"prompt":"TEXT-EVIDENCE FALLBACK: the breeder-operated cultivar page exposes cultivar-specific imagery, but the visual pixels were not retrievable in this run in a form sufficient for trustworthy image-derived morphology extraction. Use only the official text morphology evidence below; evidence alignment is NOT_APPLICABLE.\nCULTIVAR IDENTITY CONTEXT: Golden Tiger by ACE Seeds; Old Malawi Killer × Koh Chang Thai × Hmong Thai × 3rd-generation Malawi male; semi-stabilized 100% sativa hybrid.\nTEXT MORPHOLOGY EVIDENCE: strong vegetative growth; dense flowers with relatively little leaf; very large and plentiful trichomes; do not infer plant-wide architecture beyond those text claims.\nPHOTOGRAPHIC CONSTRAINTS: photorealistic botanical reference photography; one mature flowering female cannabis plant; complete plant visible; neutral natural light; neutral non-distracting background; realistic botany; no text; no collage.\nNEGATIVE CONSTRAINTS: no fruit or berries; no people; no labels or logos; no jars, bags, boxes or bottles; no smoke; no unrelated objects; no fantasy anatomy; do not add cultivar-specific morphology beyond the cited official text evidence.","evidence":[{"description":"[EVIDENCE_ALIGNMENT=NOT_APPLICABLE] Official cultivar imagery is present on the breeder-operated page, but its pixels were not retrievable in this run in a form sufficient for trustworthy visual morphology extraction. No image-derived claims are made; all non-alignment AI visual QA gates remain required.","sourceIds":["ace-seeds-golden-tiger"]},{"description":"Official text morphology evidence: strong vegetative growth; dense flowers with relatively little leaf; very large and plentiful trichomes; do not infer plant-wide architecture beyond those text claims.","sourceIds":["ace-seeds-golden-tiger"]}],"alt":"Golden TigerのACE Seeds公式テキスト形態情報を基礎に、未確認の画像由来形態を付加せず作成するAI生成参考ビジュアル","rights":"AI-generated project asset for Cannabis Strain Wisdom. No official or third-party image is copied or stored; prompt uses official text evidence only because visual retrieval was insufficient for image-derived morphology.","scope":"cultivar","aiGenerated":true},"visuals":[],"notes":"DIVERSITY-FIRST / NO NEAR-DUPLICATE FIVE. normalizedBaseCultivar=goldentiger; exact/base-family/alias collision=NO at preflight; official visual evidence=INSUFFICIENT for image-derived extraction, so text-grounded fallback is used."}